[
  {
    "genre_id": "bachelor",
    "display_name": "Bachelor / Solo Pad",
    "persona_type": "life_stage",
    "emoji": "🥃",
    "blurb": "A moody, leather-and-brass lounge built for an audience of one.",
    "style_note": "Controlled, moody and unapologetically indulgent: dark walls, worn-in leather, brass glints and low cinematic light. Every piece is a statement, nothing is a compromise — it's built for an audience of one.",
    "room": { "shape": "rect", "width_cm": 520, "length_cm": 420 },
    "room_type": "living",
    "materials": { "wall_color": "#46484B", "floor": "espresso" },
    "placed_items": [
      { "archetype_id": "storage-media", "x": 260, "z": 30, "rot_deg": 0, "color": "#2c2b29" },
      { "archetype_id": "decor-tv-large", "x": 260, "z": 30, "rot_deg": 0 },
      { "archetype_id": "sofa-3", "x": 260, "z": 332, "rot_deg": 180, "color": "#34373d" },
      { "archetype_id": "table-coffee", "x": 260, "z": 256, "rot_deg": 0, "color": "#3a3a3d" },
      { "archetype_id": "decor-rug-large", "x": 260, "z": 290, "rot_deg": 0, "color": "#3b3a36", "w": 300, "d": 250 },
      { "archetype_id": "chair-wingback", "x": 95, "z": 250, "rot_deg": 55, "color": "#5a3f30" },
      { "archetype_id": "storage-barcart", "x": 470, "z": 70, "rot_deg": 0, "color": "#8a8a8a" },
      { "archetype_id": "storage-bookcase", "x": 40, "z": 150, "rot_deg": 90, "color": "#5e4836" },
      { "archetype_id": "decor-lamp-arc", "x": 450, "z": 340, "rot_deg": 0, "color": "#B08D57" },
      { "archetype_id": "decor-tree", "x": 480, "z": 380, "rot_deg": 0 }
    ],
    "pinterest_sources": [
      "https://www.pinterest.com/ideas/modern-bachelor-pad-living-rooms/925803655850/",
      "https://www.pinterest.com/mojodesigner/bachelor-pad/",
      "https://www.pinterest.com/designthusiasm/bachelor-pads-home-decor/",
      "https://www.decorilla.com/online-decorating/bachelor-pad-design-ideas/",
      "https://www.thecoolist.com/masculine-living-room-ideas-for-2026/",
      "https://colemanfurniture.com/resources/inspiration/bachelor-pad-ideas"
    ],
    "asset_requests": ["framed_wall_art", "turntable_record_player", "wall_tv_mount"]
  },
  {
    "genre_id": "couple",
    "display_name": "Young Couple",
    "persona_type": "life_stage",
    "emoji": "🛋️",
    "blurb": "Cozy-modern, balanced 'his + hers' warm neutrals built for two.",
    "style_note": "Cozy-modern with a balanced 'his + hers' warm-neutral palette — greige walls, oak floors, linen and wool, sage and navy in equilibrium. Organized around two-person togetherness: a shared sofa, a pair of facing chairs, one shared focal point and a personal reading nook.",
    "room": { "shape": "rect", "width_cm": 500, "length_cm": 400 },
    "room_type": "living",
    "materials": { "wall_color": "#D7D1C8", "floor": "natural-oak" },
    "placed_items": [
      { "archetype_id": "storage-media", "x": 250, "z": 30, "rot_deg": 0, "color": "#9a7a52" },
      { "archetype_id": "decor-tv", "x": 250, "z": 30, "rot_deg": 0 },
      { "archetype_id": "sofa-3", "x": 250, "z": 312, "rot_deg": 180, "color": "#b9b0a3" },
      { "archetype_id": "table-coffee", "x": 250, "z": 236, "rot_deg": 0, "color": "#8a5a36" },
      { "archetype_id": "decor-rug-large", "x": 250, "z": 270, "rot_deg": 0, "color": "#c2a889", "w": 300, "d": 250 },
      { "archetype_id": "chair-accent", "x": 95, "z": 240, "rot_deg": 55, "color": "#9DC183" },
      { "archetype_id": "chair-accent", "x": 405, "z": 240, "rot_deg": 305, "color": "#9DC183" },
      { "archetype_id": "table-side", "x": 60, "z": 320, "rot_deg": 0, "color": "#9a6a40" },
      { "archetype_id": "decor-lamp-table", "x": 60, "z": 320, "rot_deg": 0, "color": "#C2A889" },
      { "archetype_id": "chair-lounge", "x": 450, "z": 200, "rot_deg": 250, "color": "#1F3A5F" },
      { "archetype_id": "decor-lamp", "x": 450, "z": 330, "rot_deg": 0, "color": "#cbb892" },
      { "archetype_id": "decor-tree", "x": 55, "z": 55, "rot_deg": 0 },
      { "archetype_id": "decor-plant", "x": 445, "z": 60, "rot_deg": 0 }
    ],
    "pinterest_sources": [
      "https://www.pinterest.com/ideas/couples-living-room/951797614497/",
      "https://www.pinterest.com/joshuabogart/modern-apartment-for-young-couple/",
      "https://www.pinterest.com/evelynsinzun/living-room-ideas-for-couples/",
      "https://havenly.com/blog/living-room-color-palette",
      "https://stylebyemilyhenderson.com/how-do-you-design-a-home-with-a-partner-caitlins-boyfriend-is-moving-in-heres-how-theyre-merging-styles",
      "https://www.spoak.com/spoakenword/living-rooms-with-two-sofas"
    ],
    "asset_requests": ["throw_pillows_blanket", "fireplace", "gallery_wall_frames"]
  },
  {
    "genre_id": "family",
    "display_name": "Family with Kids",
    "persona_type": "life_stage",
    "emoji": "🧸",
    "blurb": "A durable, TV-centric family room with a big sectional and hidden toy storage.",
    "style_note": "A durable, relaxed family/media room built around a large washable sectional, a soft anchoring rug and abundant hidden toy storage, all in warm neutrals so color stays refreshable. Function-first and TV-centric, with rounded edges, anchored storage and generous walkways.",
    "room": { "shape": "rect", "width_cm": 600, "length_cm": 450 },
    "room_type": "family",
    "materials": { "wall_color": "#CFC6BC", "floor": "honey" },
    "placed_items": [
      { "archetype_id": "storage-media", "x": 300, "z": 30, "rot_deg": 0, "color": "#7a6a58" },
      { "archetype_id": "decor-tv-large", "x": 300, "z": 30, "rot_deg": 0 },
      { "archetype_id": "sofa-sectional", "x": 300, "z": 305, "rot_deg": 180, "color": "#2f3a4a" },
      { "archetype_id": "ottoman-rect", "x": 300, "z": 195, "rot_deg": 0, "color": "#b6a89a" },
      { "archetype_id": "decor-rug-large", "x": 300, "z": 255, "rot_deg": 0, "color": "#c9a38e", "w": 360, "d": 260 },
      { "archetype_id": "table-side", "x": 510, "z": 340, "rot_deg": 0, "color": "#90633d" },
      { "archetype_id": "decor-lamp-table", "x": 510, "z": 340, "rot_deg": 0, "color": "#d8c69a" },
      { "archetype_id": "chair-accent", "x": 520, "z": 250, "rot_deg": 250, "color": "#b6a89a" },
      { "archetype_id": "ottoman-pouf", "x": 110, "z": 360, "rot_deg": 0, "color": "#9DC183" },
      { "archetype_id": "storage-cube", "x": 45, "z": 150, "rot_deg": 90, "color": "#b6b2aa" },
      { "archetype_id": "storage-bookcase", "x": 560, "z": 150, "rot_deg": 270, "color": "#9a7a52" },
      { "archetype_id": "storage-trunk", "x": 300, "z": 425, "rot_deg": 0, "color": "#9a7a52" },
      { "archetype_id": "decor-lamp", "x": 45, "z": 410, "rot_deg": 0, "color": "#cbb892" },
      { "archetype_id": "decor-plant", "x": 560, "z": 55, "rot_deg": 0 }
    ],
    "pinterest_sources": [
      "https://www.pinterest.com/jlriccio05/kid-friendly-family-room-ideas/",
      "https://www.pinterest.com/ideas/child-friendly-living-room/957831890807/",
      "https://www.pinterest.com/ideas/toy-storage-under-tv/917333008054/",
      "https://www.decorilla.com/online-decorating/family-friendly-living-room-ideas/",
      "https://www.spacejoy.com/interior-designs-blog/best-living-room-layouts-family-friendly-minimalist-homes",
      "https://www.designcafe.com/blog/living-room-interiors/kid-friendly-living-room-ideas/"
    ],
    "asset_requests": ["framed_kids_art", "throw_pillows", "wall_tv_mount", "lift_top_storage_coffee_table"]
  },
  {
    "genre_id": "anime_otaku",
    "display_name": "Anime / Otaku",
    "persona_type": "interest",
    "emoji": "🎌",
    "blurb": "A neon-lit shrine of figure shelves, manga and a gaming-anime battlestation.",
    "style_note": "Late-night Tokyo-bedroom energy: a curated shrine to your faves where glass cabinets of figures and a neon-lit battlestation share walls with poster collages and color-sorted manga. Commit to one color story and let the lighting carry the vibe.",
    "room": { "shape": "rect", "width_cm": 420, "length_cm": 460 },
    "room_type": "bedroom",
    "materials": { "wall_color": "#1C1C22", "floor": "grey-wood" },
    "placed_items": [
      { "archetype_id": "bed-platform", "x": 110, "z": 135, "rot_deg": 0, "color": "#2a2d36" },
      { "archetype_id": "storage-nightstand", "x": 235, "z": 80, "rot_deg": 0, "color": "#2f3340" },
      { "archetype_id": "decor-lamp-table", "x": 235, "z": 80, "rot_deg": 0, "color": "#A020F0" },
      { "archetype_id": "storage-shelving", "x": 320, "z": 28, "rot_deg": 0, "color": "#2a2a30" },
      { "archetype_id": "storage-wall-shelf", "x": 180, "z": 18, "rot_deg": 0, "color": "#26262e" },
      { "archetype_id": "storage-wall-shelf", "x": 110, "z": 18, "rot_deg": 0, "color": "#26262e" },
      { "archetype_id": "storage-bookcase", "x": 395, "z": 150, "rot_deg": 270, "color": "#2a2a30" },
      { "archetype_id": "storage-cube", "x": 50, "z": 320, "rot_deg": 90, "color": "#26262e" },
      { "archetype_id": "desk-office", "x": 300, "z": 425, "rot_deg": 180, "color": "#2c2b30" },
      { "archetype_id": "chair-gaming", "x": 300, "z": 355, "rot_deg": 0, "color": "#2f3340" },
      { "archetype_id": "decor-tv", "x": 300, "z": 425, "rot_deg": 180 },
      { "archetype_id": "decor-rug-round", "x": 185, "z": 300, "rot_deg": 0, "color": "#3a2a4a", "w": 190, "d": 190 },
      { "archetype_id": "ottoman-bean", "x": 110, "z": 360, "rot_deg": 0, "color": "#FF2D95" },
      { "archetype_id": "decor-lamp", "x": 395, "z": 440, "rot_deg": 0, "color": "#00E5FF" }
    ],
    "pinterest_sources": [
      "https://www.pinterest.com/samandth3/anime-figure-collection-display/",
      "https://www.pinterest.com/sleepyvixx1/anime-and-manga-room-ideas/",
      "https://www.pinterest.com/otakugirlfl4327/otaku-rooms/",
      "https://www.pinterest.com/ideas/anime-figures-display-ideas/925860691420/",
      "https://mightypaint.com/anime-bedroom-decor-ideas/",
      "https://blog.displate.com/anime-room-ideas/",
      "https://www.otakufantasy.com/2022/01/anime-room-how-to-create-otaku-corner.html",